{"$schema":"https://json-schema.org/draft/2020-12/schema","$id":"shadow-ladder-validation.v0","type":"object","required":["schemaVersion","verdict","candidateId","candidateFingerprint","checksPassed","checksFailed","checks","reportFingerprint"],"properties":{"schemaVersion":{"const":"shadow-ladder-validation.v0"},"verdict":{"enum":["PASS","FAIL"]},"candidateId":{"const":"SHADOW_LADDER_v0"},"candidateFingerprint":{"type":"string","pattern":"^[0-9a-f]{64}$"},"checksPassed":{"type":"integer"},"checksFailed":{"type":"integer"},"checks":{"type":"array"},"reportFingerprint":{"type":"string","pattern":"^[0-9a-f]{64}$"}}}
